{
  "meta": {
    "assessmentId": "asm-allcloud-demo-001",
    "generatedAt": "2026-05-08T00:00:00.000Z",
    "orgName": "Vector Systems",
    "orgIdentifier": "00D3x000001AjYCEA0",
    "truthLabel": "real_org_data",
    "schemaVersion": "1.0"
  },
  "orgProfile": {
    "edition": "Enterprise",
    "cpqVersion": "Spring '25 Managed Package",
    "activeUsers": 84,
    "totalLicenses": 112,
    "adoptionRate": 0.75,
    "userGrowth24m": 16,
    "teams": {
      "enterpriseSales": { "users": 12, "activity": "daily" },
      "renewals": { "users": 28, "activity": "weekly" },
      "dealDesk": { "users": 6, "activity": "daily" }
    },
    "dataVolume": {
      "products": 176,
      "productFamilies": 12,
      "dormantProducts": 87,
      "bundleCapableProducts": 19,
      "activeQuotes": 2100,
      "totalQuotes24m": 10240,
      "averageCycleDays": 8.5,
      "historicalQuotes": 8140,
      "closedWonValue24m": 147000000,
      "activeContracts": 1200,
      "activeSubscriptions": 3600,
      "currencies": ["AUD", "GBP", "EUR", "NZD", "USD"]
    },
    "topProduct": {
      "name": "SmartBytes",
      "launchDate": "2024-06",
      "recentVolumeShare": 0.47
    },
    "integrations": [
      {
        "name": "SAP ERP",
        "type": "erp",
        "direction": "bidirectional"
      },
      {
        "name": "Salesforce Billing",
        "type": "billing",
        "version": "v232.3.0",
        "direction": "bidirectional"
      },
      {
        "name": "DocuSign CLM",
        "type": "document_generation",
        "direction": "outbound"
      },
      {
        "name": "MockAdapter v1.4.0",
        "type": "other",
        "direction": "outbound",
        "notes": "Internal integration layer — needs architect investigation"
      }
    ]
  },
  "verdict": {
    "recommendation": "Proceed_With_Caution",
    "rationale": "Low complexity migration (overall 26/100) with strong architectural fit. 87% of artifacts map cleanly to ARM equivalents at 96% confidence. The key risks are the SmartBytes filter rule (no direct ARM equivalent, requires custom architect design) and 4 plugin interfaces (POC validation required). The largest win is retiring bespoke amendment Apex in favour of native Asset Lifecycle. Proceed conditional on plugin POC validation and SmartBytes filter UAT."
  },
  "complexityScores": {
    "overall": "Low",
    "overallNumeric": 26,
    "dimensions": {
      "pricingLogic": {
        "score": 36,
        "tier": "Low",
        "signal": "20 price rules, 5 QCP scripts, 22 discount schedules, 3 quote-calculation Apex dependencies",
        "evidence": {
          "summary": [
            "Pricing logic is rules-based and traceable.",
            "5 QCP scripts and 4 plugin interfaces account for ~70% of architect-required work."
          ],
          "detailed": [
            {
              "metric": "Price rules",
              "value": 20,
              "source": "Org scan"
            },
            {
              "metric": "QCP scripts",
              "value": 5,
              "source": "Org scan"
            },
            {
              "metric": "Discount schedules",
              "value": 22,
              "source": "Org scan"
            },
            {
              "metric": "Quote-calc Apex dependencies",
              "value": 3,
              "source": "Static analysis"
            }
          ],
          "raw": {
            "artifactReferences": [
              "q-001",
              "q-003",
              "a-001"
            ]
          }
        }
      },
      "productCatalog": {
        "score": 32,
        "tier": "Low",
        "signal": "176 products in 12 families, 19 bundle-capable, 87 dormant. SmartBytes (47% volume) launched mid-2024.",
        "evidence": {
          "summary": [
            "Mid-sized catalog with moderate bundle count.",
            "87 dormant products are Phase 4 rationalization candidates.",
            "SmartBytes product line drives nearly half of recent volume."
          ],
          "detailed": [
            {
              "metric": "Products",
              "value": 176,
              "source": "Org data volume"
            },
            {
              "metric": "Product families",
              "value": 12,
              "source": "Org scan"
            },
            {
              "metric": "Bundle-capable products",
              "value": 19,
              "source": "Org scan"
            },
            {
              "metric": "Dormant products",
              "value": 87,
              "source": "Org scan"
            }
          ],
          "raw": {
            "artifactReferences": [
              "pdr-001",
              "pdr-002"
            ]
          }
        }
      },
      "customCode": {
        "score": 22,
        "tier": "Low",
        "signal": "109 Apex classes, 8 Apex triggers, 5 QCP scripts, 4 plugin interfaces",
        "evidence": {
          "summary": [
            "Custom code footprint is manageable.",
            "5 QCP scripts and 4 plugin interfaces are the highest-risk items.",
            "87% of logic maps cleanly to ARM at 96% confidence."
          ],
          "detailed": [
            {
              "metric": "Apex classes",
              "value": 109,
              "source": "Org scan"
            },
            {
              "metric": "Apex triggers",
              "value": 8,
              "source": "Org scan"
            },
            {
              "metric": "QCP scripts",
              "value": 5,
              "source": "Org scan"
            },
            {
              "metric": "Plugin interfaces",
              "value": 4,
              "source": "Org scan"
            }
          ],
          "raw": {
            "artifactReferences": [
              "a-001",
              "a-002",
              "a-003",
              "a-004"
            ]
          }
        }
      },
      "dataMigration": {
        "score": 28,
        "tier": "Low",
        "signal": "8,140 historical quotes, $147M closed-won value, 5 currencies (AUD, GBP, EUR, NZD, USD)",
        "evidence": {
          "summary": [
            "Historical quote archive requires finance validation for SOX compliance.",
            "Multi-currency support across 5 currencies.",
            "10,240 quotes over 24 months — volume is defensible for ROI."
          ],
          "detailed": [
            {
              "metric": "Total quotes (24 months)",
              "value": 10240,
              "source": "Org data volume"
            },
            {
              "metric": "Historical quote archive",
              "value": 8140,
              "source": "Org data volume"
            },
            {
              "metric": "Closed-won value (24m)",
              "value": 147000000,
              "source": "Org data volume"
            },
            {
              "metric": "Currencies",
              "value": 5,
              "source": "Org scan"
            }
          ],
          "raw": {
            "artifactReferences": []
          }
        }
      },
      "integrations": {
        "score": 30,
        "tier": "Low",
        "signal": "4 integrations: SAP ERP (bi-directional), Salesforce Billing v232.3.0, DocuSign CLM, MockAdapter v1.4.0",
        "evidence": {
          "summary": [
            "SAP ERP integration is bidirectional and well-documented.",
            "Salesforce Billing v232.3.0 must survive migration (revenue recognition path).",
            "MockAdapter v1.4.0 is a suspicious internal layer needing architect investigation."
          ],
          "detailed": [
            {
              "metric": "Integrations",
              "value": 4,
              "source": "Org scan"
            },
            {
              "metric": "Documented contracts",
              "value": 3,
              "source": "Org scan"
            }
          ],
          "raw": {
            "artifactReferences": [
              "concern-legacy-provisioning"
            ]
          }
        }
      },
      "deprecatedConfig": {
        "score": 18,
        "tier": "Low",
        "signal": "87 dormant products, 18 orphaned price rules",
        "evidence": {
          "summary": [
            "87 products haven't been quoted in 6 months — Phase 4 rationalization.",
            "Standard pre-migration hygiene scope."
          ],
          "detailed": [
            {
              "metric": "Dormant products",
              "value": 87,
              "source": "Org scan"
            },
            {
              "metric": "Orphaned price rules",
              "value": 18,
              "source": "Org scan"
            }
          ],
          "raw": {
            "artifactReferences": [
              "concern-deprecated-cleanup"
            ]
          }
        }
      }
    }
  },
  "topConcerns": [
    {
      "id": "concern-pricing-translation",
      "title": "Pricing logic translation risk",
      "severity": "High",
      "audienceFraming": {
        "executive": {
          "headline": "Pricing logic is the migration's critical path.",
          "impact": "7 QCP scripts and Apex pricing currently determine quote totals. Translation errors land in invoices.",
          "nextAction": "Schedule a pricing-focused validation workshop with the CPQ admin and the AllCloud delivery lead before SOW commitment."
        },
        "sales": {
          "headline": "Open the discovery call by aligning on pricing intent before pricing implementation.",
          "sowCaveat": "Pricing procedure design assumes validated pricing logic intent — variance triggers a change order.",
          "talkingPoint": "\"Your pricing today runs in the browser via QCP plus a few Apex pieces. ARM moves it server-side and gives you a price waterfall. The migration cost is mostly in validating intent, not writing code.\""
        },
        "salesforce": {